,Movie ID,Title,IMDB Rating,Directors,Writers,Stars,Storyline,Release Date,Origin Countries,Languages,Budget,Gross Worldwide,Runtime,Genres
105,tt14824600,The Lord of the Rings: The War of the Rohirrim,N/A,​Kenji Kamiyama,"noneWriters, ​Jeffrey Addiss, ​Phoebe Gittins, ​Will Matthews, noneWriters","noneStars, ​Brian Cox, ​Miranda Otto, ​Lorraine Ashbourne, noneStars","The untold story behind Helm's Deep, hundreds of years before the fateful war, telling the life and bloodsoaked times of its founder, Helm Hammerhand, the King of Rohan.",Release date,"United States, Japan, United Kingdom",English,N/A,N/A,2 hours 10 minutes,"Animation, Action, Adventure"
106,tt7510222,Despicable Me 4,6.4,"​Chris Renaud, ​Patrick Delage","​Ken Daurio, ​Mike White","noneStars, ​Steve Carell, ​Kristen Wiig, ​Joey King, noneStars","Gru, Lucy, Margo, Edith, and Agnes welcome a new member to the family, Gru Jr., who is intent on tormenting his dad. Gru faces a new nemesis in Maxime Le Mal and his girlfriend Valentina, and the family is forced to go on the run.",Release date,United States,English,N/A,N/A,1 hour 35 minutes,"Animation, Adventure, Comedy"
107,tt21692408,Kung Fu Panda 4,6.3,"​Mike Mitchell, ​Stephanie Stine","noneWriters, ​Jonathan Aibel, ​Glenn Berger, ​Darren Lemke, noneWriters","noneStars, ​Jack Black, ​Awkwafina, ​Viola Davis, noneStars","After Po is tapped to become the Spiritual Leader of the Valley of Peace, he needs to find and train a new Dragon Warrior, while a wicked sorceress plans to re-summon all the master villains whom Po has vanquished to the spirit realm.",Release date,"United States, China","Mandarin, Chinese, English","$85,000,000 (estimated)","$543,622,314",1 hour 34 minutes,"Animation, Action, Adventure"
108,tt13622970,Moana 2,N/A,"​David G. Derrick Jr., ​Jason Hand, ​Dana Ledoux Miller","noneWriters, ​David G. Derrick Jr., ​Ron Clements, ​John Musker, noneWriters","noneStars, ​Auli'i Cravalho, ​Dwayne Johnson, ​Alan Tudyk, noneStars","After receiving an unexpected call from her wayfinding ancestors, Moana journeys to the far seas of Oceania and into dangerous, long-lost waters for an adventure unlike anything she has ever faced.",Release date,"United States, Canada",English,N/A,N/A,N/A,"Animation, Adventure, Comedy"
109,tt9471678,Ultraman: Rising,7.0,"​Shannon Tindle, ​John Aoshima","​Shannon Tindle, ​Marc Haimes","noneStars, ​Tamlyn Tomita, ​Hiro Nakamura, ​Rob Fukuzaki, noneStars","Ken Sato, a superstar baseball player who returns to Japan to become the latest hero to carry the mantle of Ultraman. However, he is compelled to raise a newborn kaiju monster, the offspring of his greatest enemy as his own child.",Release date,"Japan, United States","English, Japanese",N/A,N/A,1 hour 57 minutes,"Animation, Action, Adventure"
110,tt9362722,Spider-Man: Across the Spider-Verse,8.6,"​Joaquim Dos Santos, ​Kemp Powers, ​Justin K. Thompson","​Phil Lord, ​Christopher Miller, ​Dave Callaham","noneStars, ​Shameik Moore, ​Hailee Steinfeld, ​Brian Tyree Henry, noneStars","Miles Morales catapults across the multiverse, where he encounters a team of Spider-People charged with protecting its very existence. When the heroes clash on how to handle a new threat, Miles must redefine what it means to be a hero.",Release date,United States,English,"$150,000,000 (estimated)","$690,897,910",2 hours 20 minutes,"Animation, Action, Adventure"
111,tt11304740,Wish,5.6,"​Chris Buck, ​Fawn Veerasunthorn","noneWriters, ​Jennifer Lee, ​Allison Moore, ​Chris Buck, noneWriters","noneStars, ​Ariana DeBose, ​Chris Pine, ​Alan Tudyk, noneStars",A young girl named Asha wishes on a star and gets a more direct answer than she bargained for when a trouble-making star comes down from the sky to join her.,Release date,United States,English,"$200,000,000 (estimated)","$254,997,360",1 hour 35 minutes,"Animation, Adventure, Comedy"
112,tt0317219,Cars,7.2,"​John Lasseter, ​Joe Ranft","noneWriters, ​John Lasseter, ​Joe Ranft, ​Jorgen Klubien, noneWriters","noneStars, ​Owen Wilson, ​Bonnie Hunt, ​Paul Newman, noneStars","On the way to the biggest race of his life, a hotshot rookie race car gets stranded in a rundown town and learns that winning isn't everything in life.",Release date,United States,"English, Italian, Japanese, Yiddish","$120,000,000 (estimated)","$461,996,328",1 hour 56 minutes,"Animation, Adventure, Comedy"
113,tt0110357,The Lion King,8.5,"​Roger Allers, ​Rob Minkoff","noneWriters, ​Irene Mecchi, ​Jonathan Roberts, ​Linda Woolverton, noneWriters","noneStars, ​Matthew Broderick, ​Jeremy Irons, ​James Earl Jones, noneStars","Lion prince Simba and his father are targeted by his bitter uncle, who wants to ascend the throne himself.",Release date,United States,"English, Swahili, Xhosa, Zulu","$45,000,000 (estimated)","$968,750,709",1 hour 28 minutes,"Animation, Adventure, Drama"
114,tt3521164,Moana,7.6,"noneDirectors, ​Ron Clements, ​John Musker, ​Don Hall, noneDirectors","noneWriters, ​Jared Bush, ​Ron Clements, ​John Musker, noneWriters","noneStars, ​Auli'i Cravalho, ​Dwayne Johnson, ​Rachel House, noneStars","In ancient Polynesia, when a terrible curse incurred by the demigod Maui reaches Moana's island, she answers the Ocean's call to seek out Maui to set things right.",Release date,United States,"English, French","$150,000,000 (estimated)","$643,332,467",1 hour 47 minutes,"Animation, Adventure, Comedy"
115,tt6718170,The Super Mario Bros. Movie,7.0,"noneDirectors, ​Aaron Horvath, ​Michael Jelenic, ​Pierre Leduc, noneDirectors",​Matthew Fogel,"noneStars, ​Chris Pratt, ​Anya Taylor-Joy, ​Charlie Day, noneStars","A plumber named Mario travels through an underground labyrinth with his brother Luigi, trying to save a captured princess.",Release date,"United States, Japan",English,"$100,000,000 (estimated)","$1,361,992,475",1 hour 32 minutes,"Animation, Adventure, Comedy"
116,tt0245429,Spirited Away,8.6,​Hayao Miyazaki,"noneWriter, ​Hayao Miyazaki, noneWriter","noneStars, ​Daveigh Chase, ​Suzanne Pleshette, ​Miyu Irino, noneStars","During her family's move to the suburbs, a sullen 10-year-old girl wanders into a world ruled by gods, witches and spirits, and where humans are changed into beasts.",Release date,Japan,"Japanese, English","$19,000,000 (estimated)","$357,561,772",2 hours 5 minutes,"Animation, Adventure, Family"
117,tt29623480,The Wild Robot,N/A,​Chris Sanders,"​Peter Brown, ​Chris Sanders","noneStars, ​Lupita Nyong'o, ​Pedro Pascal, ​Catherine O'Hara, noneStars","After a shipwreck, an intelligent robot called Roz is stranded on an uninhabited island. To survive the harsh environment, Roz bonds with the island's animals and cares for an orphaned baby goose.",Release date,United States,English,N/A,N/A,N/A,"Animation, Adventure, Comedy"
118,tt8864596,Transformers One,N/A,​Josh Cooley,"​Andrew Barrer, ​Gabriel Ferrari, ​Bobby Rubio","noneStars, ​Chris Hemsworth, ​Brian Tyree Henry, ​Scarlett Johansson, noneStars","The untold origin story of Optimus Prime and Megatron, better known as sworn enemies, but once were friends bonded like brothers who changed the fate of Cybertron forever.",Release date,United States,English,N/A,N/A,N/A,"Animation, Action, Adventure"
119,tt0382932,Ratatouille,8.1,"​Brad Bird, ​Jan Pinkava","noneWriters, ​Brad Bird, ​Jan Pinkava, ​Jim Capobianco, noneWriters","noneStars, ​Brad Garrett, ​Lou Romano, ​Patton Oswalt, noneStars",A rat who can cook makes an unusual alliance with a young kitchen worker at a famous Paris restaurant.,Release date,United States,"English, French","$150,000,000 (estimated)","$623,728,318",1 hour 51 minutes,"Animation, Adventure, Comedy"
120,tt6495056,Migration,6.7,"​Benjamin Renner, ​Guylo Homsy","noneWriters, ​Mike White, ​Benjamin Renner, ​Ken Daurio, noneWriters","noneStars, ​Kumail Nanjiani, ​Tresi Gazal, ​Elizabeth Banks, noneStars",A family of ducks try to convince their overprotective father to go on the vacation of a lifetime.,Release date,United States,English,"$70,000,000 (estimated)","$298,776,052",1 hour 23 minutes,"Animation, Adventure, Comedy"
121,tt10442352,Thelma the Unicorn,5.8,"​Jared Hess, ​Lynn Wang","​Jared Hess, ​Jerusha Hess, ​Aaron Blabey","noneStars, ​Brittany Howard, ​Will Forte, ​Jon Heder, noneStars","When a rare pink and glitter-filled moment of fate makes Thelma the Pony's wish of being a unicorn come true, she rises to instant international pop-superstar stardom, but at an unexpected cost.",Release date,"Canada, United States",English,N/A,N/A,1 hour 33 minutes,"Animation, Adventure, Comedy"
122,tt1490017,The Lego Movie,7.7,"​Phil Lord, ​Christopher Miller","noneWriters, ​Phil Lord, ​Christopher Miller, ​Dan Hageman, noneWriters","noneStars, ​Chris Pratt, ​Will Ferrell, ​Elizabeth Banks, noneStars","An ordinary LEGO construction worker, thought to be the prophesied as ""special"", is recruited to join a quest to stop an evil tyrant from gluing the LEGO universe into eternal stasis.",Release date,"United States, Denmark, Australia, Norway","English, Turkish","$60,000,000 (estimated)","$470,759,687",1 hour 40 minutes,"Animation, Action, Adventure"
123,tt15789038,Elemental,7.0,​Peter Sohn,"noneWriters, ​John Hoberg, ​Kat Likkel, ​Brenda Hsueh, noneWriters","noneStars, ​Leah Lewis, ​Mamoudou Athie, ​Ronnie Del Carmen, noneStars","Follows Ember and Wade, in a city where fire-, water-, earth- and air-residents live together.",Release date,United States,English,"$200,000,000 (estimated)","$496,444,308",1 hour 41 minutes,"Animation, Adventure, Comedy"
124,tt2380307,Coco,8.4,"​Lee Unkrich, ​Adrian Molina","noneWriters, ​Lee Unkrich, ​Jason Katz, ​Matthew Aldrich, noneWriters","noneStars, ​Anthony Gonzalez, ​Gael García Bernal, ​Benjamin Bratt, noneStars","Aspiring musician Miguel, confronted with his family's ancestral ban on music, enters the Land of the Dead to find his great-great-grandfather, a legendary singer.",Release date,"United States, Mexico","English, Spanish","$175,000,000 (estimated)","$828,369,186",1 hour 45 minutes,"Animation, Adventure, Drama"
125,tt6467266,Sing 2,7.3,"​Garth Jennings, ​Christophe Lourdelet",​Garth Jennings,"noneStars, ​Matthew McConaughey, ​Reese Witherspoon, ​Scarlett Johansson, noneStars",Buster Moon and his friends must persuade reclusive rock star Clay Calloway to join them for the opening of a new show.,Release date,"United States, Japan, France",English,"$85,000,000 (estimated)","$408,402,685",1 hour 50 minutes,"Animation, Adventure, Comedy"
126,tt2224026,Home,6.5,​Tim Johnson,"​Tom J. Astle, ​Matt Ember, ​Adam Rex","noneStars, ​Jim Parsons, ​Rihanna, ​Steve Martin, noneStars","An alien on the run from his own people makes friends with a girl. He tries to help her on her quest, but can be an interference.",Release date,"United States, India","English, French","$135,000,000 (estimated)","$386,041,607",1 hour 34 minutes,"Animation, Adventure, Comedy"
127,tt0114709,Toy Story,8.3,​John Lasseter,"noneWriters, ​John Lasseter, ​Pete Docter, ​Andrew Stanton, noneWriters","noneStars, ​Tom Hanks, ​Tim Allen, ​Don Rickles, noneStars",A cowboy doll is profoundly threatened and jealous when a new spaceman action figure supplants him as top toy in a boy's bedroom.,Release date,United States,English,"$30,000,000 (estimated)","$394,436,586",1 hour 21 minutes,"Animation, Adventure, Comedy"
128,tt14362112,Trolls Band Together,6.0,"​Walt Dohrn, ​Tim Heitz","​Elizabeth Tippet, ​Thomas Dam","noneStars, ​Anna Kendrick, ​Justin Timberlake, ​Kenan Thompson, noneStars","Poppy discovers that Branch was once part of the boy band 'BroZone' with his brothers, Floyd, John Dory, Spruce and Clay. When Floyd is kidnapped, Branch and Poppy embark on a journey to reunite his two other brothers and rescue Floyd.",Release date,"United States, United Kingdom","English, Spanish",N/A,"$209,356,217",1 hour 31 minutes,"Animation, Adventure, Comedy"
129,tt0126029,Shrek,7.9,"​Andrew Adamson, ​Vicky Jenson","noneWriters, ​William Steig, ​Ted Elliott, ​Terry Rossio, noneWriters","noneStars, ​Mike Myers, ​Eddie Murphy, ​Cameron Diaz, noneStars","A mean lord exiles fairytale creatures to the swamp of a grumpy ogre, who must go on a quest and rescue a princess for the lord in order to get his land back.",Release date,United States,English,"$60,000,000 (estimated)","$488,628,188",1 hour 30 minutes,"Animation, Adventure, Comedy"
130,tt8589698,Teenage Mutant Ninja Turtles: Mutant Mayhem,7.2,"​Jeff Rowe, ​Kyler Spears","noneWriters, ​Seth Rogen, ​Evan Goldberg, ​Jeff Rowe, noneWriters","noneStars, ​Micah Abbey, ​Shamon Brown Jr., ​Nicolas Cantu, noneStars",The Turtle brothers work to earn the love of New York City while facing down an army of mutants.,Release date,"United States, Japan, Canada",English,"$70,000,000 (estimated)","$180,513,586",1 hour 39 minutes,"Animation, Action, Adventure"
131,tt0317705,The Incredibles,8.0,​Brad Bird,​Brad Bird,"noneStars, ​Craig T. Nelson, ​Samuel L. Jackson, ​Holly Hunter, noneStars","While trying to lead a quiet suburban life, a family of undercover superheroes are forced into action to save the world.",Release date,United States,"English, French, German, Italian, Portuguese, Russian","$92,000,000 (estimated)","$631,688,498",1 hour 55 minutes,"Animation, Action, Adventure"
132,tt0910970,WALL·E,8.4,​Andrew Stanton,"noneWriters, ​Andrew Stanton, ​Pete Docter, ​Jim Reardon, noneWriters","noneStars, ​Ben Burtt, ​Elissa Knight, ​Jeff Garlin, noneStars","In the distant future, a small waste-collecting robot inadvertently embarks on a space journey that will ultimately decide the fate of mankind.",Release date,"United States, Japan",English,"$180,000,000 (estimated)","$527,402,840",1 hour 38 minutes,"Animation, Adventure, Family"
133,tt2953050,Encanto,7.2,"​Jared Bush, ​Byron Howard, ​Charise Castro Smith","noneWriters, ​Charise Castro Smith, ​Jared Bush, ​Byron Howard, noneWriters","noneStars, ​Stephanie Beatriz, ​María Cecilia Botero, ​John Leguizamo, noneStars",A Colombian teenage girl has to face the frustration of being the only member of her family without magical powers.,Release date,United States,"English, Spanish","$50,000,000 (estimated)","$256,786,742",1 hour 42 minutes,"Animation, Comedy, Family"
134,tt0398286,Tangled,7.7,"​Nathan Greno, ​Byron Howard","​Dan Fogelman, ​Jacob Grimm, ​Wilhelm Grimm","noneStars, ​Mandy Moore, ​Zachary Levi, ​Donna Murphy, noneStars","The magically long-haired Rapunzel has spent her entire life in a tower, but now that a runaway thief has stumbled upon her, she is about to discover the world for the first time, and who she really is.",Release date,"United States, Japan","English, German","$260,000,000 (estimated)","$592,472,813",1 hour 40 minutes,"Animation, Adventure, Comedy"
135,tt6587046,The Boy and the Heron,7.6,​Hayao Miyazaki,"noneWriter, ​Hayao Miyazaki, noneWriter","noneStars, ​Soma Santoki, ​Masaki Suda, ​Kô Shibasaki, noneStars","In the wake of his mother's death and his father's remarriage, a headstrong boy named Mahito ventures into a dreamlike world shared by both the living and the dead.",Release date,Japan,"English, Japanese",N/A,"$173,786,633",2 hours 4 minutes,"Animation, Adventure, Drama"
136,tt0266543,Finding Nemo,8.2,"​Andrew Stanton, ​Lee Unkrich","noneWriters, ​Andrew Stanton, ​Bob Peterson, ​David Reynolds, noneWriters","noneStars, ​Albert Brooks, ​Ellen DeGeneres, ​Alexander Gould, noneStars","After his son is captured in the Great Barrier Reef and taken to Sydney, a timid clownfish sets out on a journey to bring him home.",Release date,"United States, Japan","English, Japanese, Russian","$94,000,000 (estimated)","$941,637,960",1 hour 40 minutes,"Animation, Adventure, Comedy"
137,tt4633694,Spider-Man: Into the Spider-Verse,8.4,"​Bob Persichetti, ​Peter Ramsey, ​Rodney Rothman","noneWriters, ​Phil Lord, ​Rodney Rothman, noneWriters","noneStars, ​Shameik Moore, ​Jake Johnson, ​Hailee Steinfeld, noneStars",Teen Miles Morales becomes the Spider-Man of his universe and must join with five spider-powered individuals from other dimensions to stop a threat for all realities.,Release date,"Canada, United States","English, Spanish","$90,000,000 (estimated)","$384,298,736",1 hour 57 minutes,"Animation, Action, Adventure"
138,tt2948356,Zootopia,8.0,"​Byron Howard, ​Rich Moore, ​Jared Bush","noneWriters, ​Byron Howard, ​Rich Moore, ​Jared Bush, noneWriters","noneStars, ​Ginnifer Goodwin, ​Jason Bateman, ​Idris Elba, noneStars","In a city of anthropomorphic animals, a rookie bunny cop and a cynical con artist fox must work together to uncover a conspiracy.",Release date,United States,English,"$150,000,000 (estimated)","$1,025,521,689",1 hour 48 minutes,"Animation, Action, Adventure"
139,tt1049413,Up,8.3,"​Pete Docter, ​Bob Peterson","noneWriters, ​Pete Docter, ​Bob Peterson, ​Tom McCarthy, noneWriters","noneStars, ​Edward Asner, ​Jordan Nagai, ​John Ratzenberger, noneStars","78-year-old Carl Fredricksen travels to Paradise Falls in his house equipped with balloons, inadvertently taking a young stowaway.",Release date,United States,English,"$175,000,000 (estimated)","$735,102,136",1 hour 36 minutes,"Animation, Adventure, Comedy"
140,tt2294629,Frozen,7.4,"​Chris Buck, ​Jennifer Lee","noneWriters, ​Jennifer Lee, ​Hans Christian Andersen, ​Chris Buck, noneWriters","noneStars, ​Kristen Bell, ​Idina Menzel, ​Jonathan Groff, noneStars","Fearless optimist Anna teams up with rugged mountain man Kristoff and his loyal reindeer Sven in an epic journey to find Anna's sister Elsa, whose icy powers have trapped the kingdom of Arendelle in eternal winter.",Release date,United States,English,"$150,000,000 (estimated)","$1,285,048,126",1 hour 42 minutes,"Animation, Adventure, Comedy"
141,tt30476486,Haikyuu!! The Dumpster Battle,7.8,​Susumu Mitsunaka,"​Haruichi Furudate, ​Susumu Mitsunaka","noneStars, ​Ayumu Murase, ​Kaito Ishikawa, ​Yûki Kaji, noneStars","Despite a strong field, the Karasuno High volleyball team advances past the preliminary round of the Harutaka tournament in Miyagi prefecture to reach the third round.",Release date,Japan,Japanese,N/A,"$88,982,652",1 hour 25 minutes,"Animation, Comedy, Drama"
142,tt1323594,Despicable Me,7.6,"​Pierre Coffin, ​Chris Renaud","​Cinco Paul, ​Ken Daurio, ​Sergio Pablos","noneStars, ​Steve Carell, ​Jason Segel, ​Russell Brand, noneStars","Gru, a criminal mastermind, adopts three orphans as pawns to carry out the biggest heist in history. His life takes an unexpected turn when the little girls see the evildoer as their potential father.",Release date,"United States, France",English,"$69,000,000 (estimated)","$543,284,256",1 hour 35 minutes,"Animation, Adventure, Comedy"
143,tt0347149,Howl's Moving Castle,8.2,​Hayao Miyazaki,"​Hayao Miyazaki, ​Diana Wynne Jones","noneStars, ​Chieko Baishô, ​Takuya Kimura, ​Tatsuya Gashûin, noneStars","When an unconfident young woman is cursed with an old body by a spiteful witch, her only chance of breaking the spell lies with a self-indulgent yet insecure young wizard and his companions in his legged, walking castle.",Release date,Japan,Japanese,"$24,000,000 (estimated)","$237,731,798",1 hour 59 minutes,"Animation, Adventure, Family"
144,tt17163970,Wallace & Gromit: Vengeance Most Fowl,N/A,"​Merlin Crossingham, ​Nick Park","​Mark Burton, ​Nick Park","noneStars, ​Adjoa Andoh, ​Reece Shearsmith, ​Diane Morgan, noneStars","Focus on Gromit's concern that Wallace has become over-dependent on his inventions, which proves justified when Wallace invents a ""smart gnome"" that seems to develop a mind of its own.",Release date,United Kingdom,English,N/A,"$191,452",N/A,"Animation, Adventure, Comedy"
145,tt6105098,The Lion King,6.8,​Jon Favreau,"noneWriters, ​Jeff Nathanson, ​Irene Mecchi, ​Jonathan Roberts, noneWriters","noneStars, ​Donald Glover, ​Beyoncé, ​Seth Rogen, noneStars","After the murder of his father, a young lion prince flees his kingdom only to learn the true meaning of responsibility and bravery.",Release date,"United States, United Kingdom, Kenya","English, Spanish","$260,000,000 (estimated)","$1,663,079,059",1 hour 58 minutes,"Animation, Adventure, Drama"
146,tt0780521,The Princess and the Frog,7.2,"​Ron Clements, ​John Musker","noneWriters, ​Ron Clements, ​John Musker, ​Greg Erb, noneWriters","noneStars, ​Anika Noni Rose, ​Keith David, ​Oprah Winfrey, noneStars","A waitress, desperate to fulfill her dreams as a restaurant owner, is set on a journey to turn a frog prince back into a human being, but she has to face the same problem after she kisses him.",Release date,"United States, Brazil, Canada","English, French","$105,000,000 (estimated)","$267,056,816",1 hour 37 minutes,"Animation, Adventure, Comedy"
147,tt5311514,Your Name.,8.4,​Makoto Shinkai,"noneWriters, ​Makoto Shinkai, ​Clark Cheng, noneWriters","noneStars, ​Ryunosuke Kamiki, ​Mone Kamishiraishi, ​Ryo Narita, noneStars","Two teenagers share a profound, magical connection upon discovering they are swapping bodies. Things manage to become even more complicated when the boy and girl decide to meet in person.",Release date,Japan,Japanese,"¥370,000,000 (estimated)","$382,238,191",1 hour 46 minutes,"Animation, Drama, Fantasy"
148,tt13429870,Robot Dreams,7.6,​Pablo Berger,"​Pablo Berger, ​Sara Varon",​Pablo Berger,The adventures and misfortunes of Dog and Robot in New York City during the 1980s.,Release date,"Spain, France",,N/A,"$4,089,339",1 hour 43 minutes,"Animation, Drama, Family"
149,tt0119282,Hercules,7.3,"​Ron Clements, ​John Musker","noneWriters, ​Ron Clements, ​John Musker, ​Don McEnery, noneWriters","noneStars, ​Tate Donovan, ​Susan Egan, ​James Woods, noneStars",The son of Zeus and Hera is stripped of his immortality as an infant and must become a true hero in order to reclaim it.,Release date,United States,"English, Spanish, Greek","$85,000,000 (estimated)","$252,712,101",1 hour 33 minutes,"Animation, Action, Adventure"
150,tt0198781,"Monsters, Inc.",8.1,"​Pete Docter, ​David Silverman, ​Lee Unkrich","noneWriters, ​Pete Docter, ​Jill Culton, ​Jeff Pidgeon, noneWriters","noneStars, ​Billy Crystal, ​John Goodman, ​Mary Gibbs, noneStars","In order to power the city, monsters have to scare children so that they scream. However, the children are toxic to the monsters, and after a child gets through, two monsters realize things may not be what they think.",Release date,United States,English,"$115,000,000 (estimated)","$579,723,768",1 hour 32 minutes,"Animation, Adventure, Comedy"
151,tt15398776,Oppenheimer,8.3,​Christopher Nolan,"​Christopher Nolan, ​Kai Bird, ​Martin Sherwin","noneStars, ​Cillian Murphy, ​Emily Blunt, ​Matt Damon, noneStars",The story of American scientist J. Robert Oppenheimer and his role in the development of the atomic bomb.,Release date,"United States, United Kingdom","English, German, Italian","$100,000,000 (estimated)","$975,134,850",3 hours,"Biography, Drama, History"
152,tt21064584,The Iron Claw,7.6,​Sean Durkin,​Sean Durkin,"noneStars, ​Zac Efron, ​Jeremy Allen White, ​Harris Dickinson, noneStars","The true story of the inseparable Von Erich brothers, who made history in the intensely competitive world of professional wrestling in the early 1980s.",Release date,"United Kingdom, United States",English,"$15,000,000 (estimated)","$45,200,720",2 hours 12 minutes,"Biography, Drama, Sport"
153,tt27470893,Chandu Champion,8.5,​Kabir Khan,"noneWriters, ​Sumit Arora, ​Kabir Khan, ​Sudipto Sarkar, noneWriters","noneStars, ​Kartik Aaryan, ​Vijay Raaz, ​Bhagyashree Patwardhan, noneStars",A man who faced one adversary after another with an undying spirit. His unwavering zeal and never give up attitude led to India's first individual gold medal in any form of the Olympics.,Release date,India,Hindi,N/A,"$127,116",2 hours 22 minutes,"Action, Biography, Drama"
154,tt1856080,The Boys in the Boat,7.0,​George Clooney,"​Daniel James Brown, ​Mark L. Smith","noneStars, ​Joel Edgerton, ​Callum Turner, ​Peter Guinness, noneStars","A 1930s-set story centered on the University of Washington's rowing team, from their Depression-era beginnings to winning gold at the 1936 Berlin Olympics.",Release date,United States,"English, German, French, Italian, Hungarian","$40,000,000 (estimated)","$55,481,773",2 hours 3 minutes,"Biography, Drama, Sport"
155,tt14914430,Unfrosted,5.5,​Jerry Seinfeld,"noneWriters, ​Jerry Seinfeld, ​Spike Feresten, ​Andy Robin, noneWriters","noneStars, ​Isaac Bae, ​Jerry Seinfeld, ​Chris Rickett, noneStars","In 1963 Michigan, business rivals Kellogg's and Post compete to create a cake that could change breakfast forever.",Release date,United States,English,"$14,200,000 (estimated)",N/A,1 hour 37 minutes,"Biography, Comedy, History"
156,tt21261712,Back to Black,6.4,​Sam Taylor-Johnson,​Matt Greenhalgh,"noneStars, ​Marisa Abela, ​Eddie Marsan, ​Jack O'Connell, noneStars","The life and music of Amy Winehouse, through the journey of adolescence to adulthood and the creation of one of the best-selling albums of our time.",Release date,"United Kingdom, France, United States",English,N/A,"$50,375,726",2 hours 2 minutes,"Biography, Drama, Music"
