,Movie ID,Title,IMDB Rating,Directors,Writers,Stars,Storyline,Release Date,Origin Countries,Languages,Budget,Gross Worldwide,Runtime,Genres
211,tt22408160,Kinds of Kindness,7.0,​Yorgos Lanthimos,"​Yorgos Lanthimos, ​Efthimis Filippou","noneStars, ​Emma Stone, ​Jesse Plemons, ​Willem Dafoe, noneStars","A man seeks to break free from his predetermined path, a cop questions his wife's demeanor after her return from a supposed drowning, and a woman searches for an extraordinary individual prophesied to become a renowned spiritual guide.",Release date,"United States, United Kingdom, Ireland",English,N/A,"$1,145,109",2 hours 44 minutes,"Comedy, Drama"
212,tt1502397,Bad Boys for Life,6.5,"​Adil El Arbi, ​Bilall Fallah","noneWriters, ​Peter Craig, ​Joe Carnahan, ​Chris Bremner, noneWriters","noneStars, ​Will Smith, ​Martin Lawrence, ​Vanessa Hudgens, noneStars",Miami detectives Mike Lowrey and Marcus Burnett must face off against a mother-and-son pair of drug lords who wreak vengeful havoc on their city.,Release date,United States,"English, Spanish","$90,000,000 (estimated)","$426,505,244",2 hours 4 minutes,"Action, Comedy, Crime"
213,tt0112442,Bad Boys,6.8,​Michael Bay,"noneWriters, ​George Gallo, ​Michael Barrie, ​Jim Mulholland, noneWriters","noneStars, ​Will Smith, ​Martin Lawrence, ​Lisa Boyle, noneStars",Two hip detectives protect a witness to a murder while investigating a case of stolen heroin from the evidence storage room from their police precinct.,Release date,United States,"English, Persian","$19,000,000 (estimated)","$141,407,024",1 hour 59 minutes,"Action, Comedy, Crime"
214,tt5779228,The Garfield Movie,5.8,​Mark Dindal,"noneWriters, ​Paul A. Kaplan, ​Mark Torgove, ​David Reynolds, noneWriters","noneStars, ​Chris Pratt, ​Samuel L. Jackson, ​Hannah Waddingham, noneStars","After Garfield's unexpected reunion with his long-lost father, ragged alley cat Vic, he and his canine friend Odie are forced from their perfectly pampered lives to join Vic on a risky heist.",Release date,"United States, United Kingdom, Hong Kong",English,"$60,000,000 (estimated)","$200,193,268",1 hour 41 minutes,"Animation, Adventure, Comedy"
215,tt5822536,Paddington in Peru,N/A,​Dougal Wilson,"noneWriters, ​Michael Bond, ​Mark Burton, ​Simon Farnaby, noneWriters","noneStars, ​Emily Mortimer, ​Olivia Colman, ​Ben Whishaw, noneStars","Follows Paddington and the Brown family as they visit Aunt Lucy in Peru, but a mystery sends them to the Amazon rainforest and up Peruvian mountains.",Release date,"United Kingdom, France",English,N/A,N/A,N/A,"Adventure, Comedy, Family"
216,tt9466114,The Idea of You,6.4,​Michael Showalter,"​Robinne Lee, ​Michael Showalter, ​Jennifer Westfeldt","noneStars, ​Anne Hathaway, ​Nicholas Galitzine, ​Ella Rubin, noneStars","Solène, a 40-year-old single mom, begins an unexpected romance with 24-year-old Hayes Campbell, the lead singer of August Moon, the hottest boy band on the planet.",Release date,United States,English,N/A,"$36,178",1 hour 55 minutes,"Comedy, Drama, Romance"
217,tt14230458,Poor Things,7.9,​Yorgos Lanthimos,"​Tony McNamara, ​Alasdair Gray","noneStars, ​Emma Stone, ​Mark Ruffalo, ​Willem Dafoe, noneStars","An account of the fantastical evolution of Bella Baxter, a young woman brought back to life by the brilliant and unorthodox scientist Dr. Godwin Baxter.",Release date,"Ireland, United Kingdom, United States, Hungary","English, French, Portuguese","$35,000,000 (estimated)","$117,625,455",2 hours 21 minutes,"Comedy, Drama, Romance"
218,tt21469794,Space Cadet,N/A,​Liz W. Garcia,​Liz W. Garcia,"noneStars, ​Emma Roberts, ​Tom Hopper, ​Poppy Liu, noneStars","Rex, a Florida party girl, turns out to be the only hope for the NASA space program after a fluke puts her in training with other candidates who may have better resumés, but don't have her smarts, heart, and moxie.",Release date,United States,English,N/A,N/A,1 hour 50 minutes,Comedy
219,tt0120791,Practical Magic,6.3,​Griffin Dunne,"noneWriters, ​Alice Hoffman, ​Robin Swicord, ​Akiva Goldsman, noneWriters","noneStars, ​Sandra Bullock, ​Nicole Kidman, ​Stockard Channing, noneStars","Two witch sisters, raised by their eccentric aunts in a small town, face closed-minded prejudice and a curse which threatens to prevent them ever finding lasting love.",Release date,United States,English,"$75,000,000 (estimated)","$46,733,235",1 hour 44 minutes,"Comedy, Drama, Fantasy"
220,tt0172156,Bad Boys II,6.6,​Michael Bay,"noneWriters, ​George Gallo, ​Marianne Wibberley, ​Cormac Wibberley, noneWriters","noneStars, ​Will Smith, ​Martin Lawrence, ​Gabrielle Union, noneStars",Two loose-cannon narcotics cops investigate the flow of Ecstasy into Florida from a Cuban drug cartel.,Release date,United States,"English, Spanish, Russian","$130,000,000 (estimated)","$273,340,010",2 hours 27 minutes,"Action, Comedy, Crime"
221,tt12593682,Bullet Train,7.3,​David Leitch,"​Zak Olkewicz, ​Kôtarô Isaka","noneStars, ​Brad Pitt, ​Joey King, ​Aaron Taylor-Johnson, noneStars",Five assassins aboard a swiftly-moving bullet train find out that their missions have something in common.,Release date,"United States, Japan","English, Japanese, Spanish, Russian","$85,900,000 (estimated)","$239,268,602",2 hours 7 minutes,"Action, Comedy, Thriller"
222,tt0120655,Dogma,7.3,​Kevin Smith,​Kevin Smith,"noneStars, ​Ben Affleck, ​Matt Damon, ​Linda Fiorentino, noneStars",An abortion clinic worker with a special heritage is called upon to save the existence of humanity from being negated by two renegade angels trying to exploit a loop-hole and reenter Heaven.,Release date,United States,"English, Spanish","$10,000,000 (estimated)","$31,429,330",2 hours 10 minutes,"Adventure, Comedy, Drama"
223,tt7510222,Despicable Me 4,6.4,"​Chris Renaud, ​Patrick Delage","​Ken Daurio, ​Mike White","noneStars, ​Steve Carell, ​Kristen Wiig, ​Joey King, noneStars","Gru, Lucy, Margo, Edith, and Agnes welcome a new member to the family, Gru Jr., who is intent on tormenting his dad. Gru faces a new nemesis in Maxime Le Mal and his girlfriend Valentina, and the family is forced to go on the run.",Release date,United States,English,N/A,N/A,1 hour 35 minutes,"Animation, Adventure, Comedy"
224,tt0799934,Be Kind Rewind,6.4,​Michel Gondry,​Michel Gondry,"noneStars, ​Jack Black, ​Yasiin Bey, ​Danny Glover, noneStars","Two bumbling store clerks inadvertently erase the footage from all of the tapes in their video rental store. In order to keep the business running, they re-shoot every film in the store with their own camera, with a budget of zero dollars.",Release date,"United Kingdom, France, United States",English,"$20,000,000 (estimated)","$30,579,406",1 hour 42 minutes,Comedy
225,tt21235248,Ghostbusters: Frozen Empire,6.1,​Gil Kenan,"noneWriters, ​Gil Kenan, ​Jason Reitman, ​Ivan Reitman, noneWriters","noneStars, ​Paul Rudd, ​Carrie Coon, ​Finn Wolfhard, noneStars","When the discovery of an ancient artifact unleashes an evil force, Ghostbusters new and old must join forces to protect their home and save the world from a second ice age.",Release date,"United States, Canada, United Kingdom",English,"$100,000,000 (estimated)","$201,627,392",1 hour 55 minutes,"Adventure, Comedy, Fantasy"
226,tt32094375,Die Hart 2: Die Harter,4.2,​Eric Appel,"noneWriters, ​Tripper Clancy, ​Derek Kolstad, noneWriters","noneStars, ​Kevin Hart, ​Nathalie Emmanuel, ​Ben Schwartz, noneStars","Hart plans an innovative action film with unscripted, unexpected scenes to cement his legacy as the greatest. However, a blind spot leads him to fall victim to a vengeful plot from his past.",Release date,United States,,N/A,N/A,1 hour 32 minutes,"Action, Comedy"
227,tt7131622,Once Upon a Time... in Hollywood,7.6,​Quentin Tarantino,​Quentin Tarantino,"noneStars, ​Leonardo DiCaprio, ​Brad Pitt, ​Margot Robbie, noneStars","As Hollywood's Golden Age is winding down during the summer of 1969, television actor Rick Dalton and his stunt double Cliff Booth endeavor to achieve lasting success in Hollywood while meeting several colorful characters along the way.",Release date,"United States, United Kingdom, China","English, Italian, Spanish, German","$90,000,000 (estimated)","$377,617,681",2 hours 41 minutes,"Comedy, Drama"
228,tt14914430,Unfrosted,5.5,​Jerry Seinfeld,"noneWriters, ​Jerry Seinfeld, ​Spike Feresten, ​Andy Robin, noneWriters","noneStars, ​Isaac Bae, ​Jerry Seinfeld, ​Chris Rickett, noneStars","In 1963 Michigan, business rivals Kellogg's and Post compete to create a cake that could change breakfast forever.",Release date,United States,English,"$14,200,000 (estimated)",N/A,1 hour 37 minutes,"Biography, Comedy, History"
229,tt0094721,Beetlejuice,7.5,​Tim Burton,"noneWriters, ​Michael McDowell, ​Larry Wilson, ​Warren Skaaren, noneWriters","noneStars, ​Alec Baldwin, ​Geena Davis, ​Michael Keaton, noneStars","The spirits of a deceased couple are harassed by an unbearable family that has moved into their home, and hire a malicious spirit to drive them out.",Release date,United States,English,"$15,000,000 (estimated)","$74,842,866",1 hour 32 minutes,"Comedy, Fantasy"
230,tt1517268,Barbie,6.8,​Greta Gerwig,"​Greta Gerwig, ​Noah Baumbach","noneStars, ​Margot Robbie, ​Ryan Gosling, ​Issa Rae, noneStars","Barbie and Ken are having the time of their lives in the colorful and seemingly perfect world of Barbie Land. However, when they get a chance to go to the real world, they soon discover the joys and perils of living among humans.",Release date,"United States, United Kingdom","English, Spanish","$100,000,000 (estimated)","$1,445,638,421",1 hour 54 minutes,"Adventure, Comedy, Fantasy"
231,tt2049403,Beetlejuice Beetlejuice,N/A,​Tim Burton,"noneWriters, ​Alfred Gough, ​Miles Millar, ​Seth Grahame-Smith, noneWriters","noneStars, ​Jenna Ortega, ​Michael Keaton, ​Monica Bellucci, noneStars","After a family tragedy, three generations of the Deetz family return home to Winter River. Still haunted by Beetlejuice, Lydia's life is turned upside down when her teenage daughter, Astrid, accidentally opens the portal to the Afterlife.",Release date,United States,English,N/A,N/A,N/A,"Comedy, Fantasy, Horror"
232,tt2937696,Everybody Wants Some!!,6.9,​Richard Linklater,​Richard Linklater,"noneStars, ​Blake Jenner, ​Tyler Hoechlin, ​Ryan Guzman, noneStars","In 1980 Texas, a college freshman moves into an old frat house with his new baseball teammates as they party their way through the final weekend of Summer.",Release date,United States,English,"$10,000,000 (estimated)","$4,644,472",1 hour 57 minutes,Comedy
233,tt26926267,Mother of the Bride,4.8,​Mark Waters,​Robin Bernheim,"noneStars, ​Brooke Shields, ​Miranda Cosgrove, ​Benjamin Bratt, noneStars",Lana's daughter Emma returns from London and announces that she's getting married next month. Things become more complicated when Lana learns that the man who stole Emma's heart is the son of the man who broke hers years ago.,Release date,United States,English,N/A,N/A,1 hour 28 minutes,"Comedy, Drama, Romance"
234,tt11762114,Mean Girls,5.6,"​Samantha Jayne, ​Arturo Perez Jr.","noneWriters, ​Tina Fey, ​Rosalind Wiseman, noneWriters","noneStars, ​Angourie Rice, ​Reneé Rapp, ​Auli'i Cravalho, noneStars","Cady Heron is a hit with the Plastics, an A-list girl clique at her new school. But everything changes when she makes the mistake of falling for Aaron Samuels, the ex-boyfriend of alpha Plastic Regina George.",Release date,United States,English,"$36,000,000 (estimated)","$104,404,248",1 hour 52 minutes,"Comedy, Musical"
235,tt15009428,Argylle,5.7,​Matthew Vaughn,​Jason Fuchs,"noneStars, ​Henry Cavill, ​Bryce Dallas Howard, ​Sam Rockwell, noneStars","A reclusive author who writes espionage novels about a secret agent and a global spy syndicate realizes the plot of the new book she's writing starts to mirror real-world events, in real time.",Release date,"United Kingdom, United States",English,"$200,000,000 (estimated)","$96,213,864",2 hours 19 minutes,"Action, Comedy, Thriller"
236,tt0248845,Hedwig and the Angry Inch,7.7,​John Cameron Mitchell,"noneWriters, ​John Cameron Mitchell, ​Stephen Trask, noneWriters","noneStars, ​John Cameron Mitchell, ​Miriam Shor, ​Stephen Trask, noneStars",A gender-queer punk-rock singer from East Berlin tours the U.S. with her band as she tells her life story and follows the former lover/band-mate who stole her songs.,Release date,"Canada, United States","English, German","$6,000,000 (estimated)","$3,660,081",1 hour 35 minutes,"Comedy, Drama, Music"
237,tt0088847,The Breakfast Club,7.8,​John Hughes,​John Hughes,"noneStars, ​Emilio Estevez, ​Judd Nelson, ​Molly Ringwald, noneStars",Five high school students meet in Saturday detention and discover how they have a great deal more in common than they thought.,Release date,United States,English,"$1,000,000 (estimated)","$51,525,171",1 hour 37 minutes,"Comedy, Drama"
238,tt0993846,The Wolf of Wall Street,8.2,​Martin Scorsese,"​Terence Winter, ​Jordan Belfort","noneStars, ​Leonardo DiCaprio, ​Jonah Hill, ​Margot Robbie, noneStars","Based on the true story of Jordan Belfort, from his rise to a wealthy stock-broker living the high life to his fall involving crime, corruption and the federal government.",Release date,United States,"English, French","$100,000,000 (estimated)","$407,039,432",3 hours,"Biography, Comedy, Crime"
239,tt21626284,Laapataa Ladies,8.5,​Kiran Rao,"​Biplab Goswami, ​Divyanidhi Sharma, ​Sneha Desai","noneStars, ​Nitanshi Goel, ​Pratibha Ranta, ​Sparsh Shrivastava, noneStars","The misadventures of two young brides who get lost from the same train. From mistaken identities to laugh-out-aloud escapades, the ensuing chaos guarantees laughter galore and heartwarming moments.",Release date,India,Hindi,N/A,"$108,886",2 hours 2 minutes,"Comedy, Drama"
240,tt21692408,Kung Fu Panda 4,6.3,"​Mike Mitchell, ​Stephanie Stine","noneWriters, ​Jonathan Aibel, ​Glenn Berger, ​Darren Lemke, noneWriters","noneStars, ​Jack Black, ​Awkwafina, ​Viola Davis, noneStars","After Po is tapped to become the Spiritual Leader of the Valley of Peace, he needs to find and train a new Dragon Warrior, while a wicked sorceress plans to re-summon all the master villains whom Po has vanquished to the spirit realm.",Release date,"United States, China","Mandarin, Chinese, English","$85,000,000 (estimated)","$543,622,314",1 hour 34 minutes,"Animation, Action, Adventure"
241,tt0079522,Manhattan,7.8,​Woody Allen,"​Woody Allen, ​Marshall Brickman","noneStars, ​Woody Allen, ​Diane Keaton, ​Mariel Hemingway, noneStars",The life of a divorced television writer dating a teenage girl is further complicated when he falls in love with his best friend's mistress.,Release date,United States,English,"$9,000,000 (estimated)","$40,194,067",1 hour 36 minutes,"Comedy, Drama, Romance"
242,tt28607951,Anora,7.4,​Sean Baker,​Sean Baker,"noneStars, ​Mikey Madison, ​Paul Weissman, ​Lindsey Normington, noneStars",Anora is a comedy about a sex worker shot in New York City and Las Vegas.,Release date,United States,English,N/A,N/A,2 hours 19 minutes,"Comedy, Drama, Romance"
243,tt23561236,American Fiction,7.5,​Cord Jefferson,"​Cord Jefferson, ​Percival Everett","noneStars, ​Jeffrey Wright, ​Tracee Ellis Ross, ​John Ortiz, noneStars",A novelist who's fed up with the establishment profiting from Black entertainment uses a pen name to write a book that propels him into the heart of the hypocrisy and madness he claims to disdain.,Release date,United States,English,N/A,"$22,483,370",1 hour 57 minutes,"Comedy, Drama"
244,tt4978420,Borderlands,N/A,​Eli Roth,"noneWriters, ​Eli Roth, ​Joe Crombie, noneWriters","noneStars, ​Gina Gershon, ​Kevin Hart, ​Cate Blanchett, noneStars","Based on the best-selling videogame, this all-star action-adventure follows a ragtag team of misfits on a mission to save a missing girl who holds the key to unimaginable power.",Release date,United States,English,N/A,N/A,1 hour 42 minutes,"Action, Adventure, Comedy"
245,tt13622970,Moana 2,N/A,"​David G. Derrick Jr., ​Jason Hand, ​Dana Ledoux Miller","noneWriters, ​David G. Derrick Jr., ​Ron Clements, ​John Musker, noneWriters","noneStars, ​Auli'i Cravalho, ​Dwayne Johnson, ​Alan Tudyk, noneStars","After receiving an unexpected call from her wayfinding ancestors, Moana journeys to the far seas of Oceania and into dangerous, long-lost waters for an adventure unlike anything she has ever faced.",Release date,"United States, Canada",English,N/A,N/A,N/A,"Animation, Adventure, Comedy"
246,tt1431045,Deadpool,8.0,​Tim Miller,"​Rhett Reese, ​Paul Wernick","noneStars, ​Ryan Reynolds, ​Morena Baccarin, ​T.J. Miller, noneStars","A wisecracking mercenary gets experimented on and becomes immortal yet hideously scarred, and sets out to track down the man who ruined his looks.",Release date,United States,English,"$58,000,000 (estimated)","$782,837,347",1 hour 48 minutes,"Action, Comedy"
247,tt7040874,A Simple Favor,6.8,​Paul Feig,"​Darcey Bell, ​Jessica Sharzer","noneStars, ​Anna Kendrick, ​Blake Lively, ​Henry Golding, noneStars","Stephanie is a single mother with a parenting vlog who befriends Emily, a secretive upper-class woman who has a child at the same elementary school. When Emily goes missing, Stephanie takes it upon herself to investigate.",Release date,"Canada, United States",English,"$20,000,000 (estimated)","$97,644,617",1 hour 57 minutes,"Comedy, Crime, Mystery"
248,tt17076046,Weird: The Al Yankovic Story,6.9,​Eric Appel,"​'Weird Al' Yankovic, ​Eric Appel","noneStars, ​Diedrich Bader, ​Daniel Radcliffe, ​Lin-Manuel Miranda, noneStars","Explores every facet of Yankovic's life, from his meteoric rise to fame with early hits like 'Eat It' and 'Like a Surgeon' to his torrid celebrity love affairs and famously depraved lifestyle.",Release date,United States,English,"$8,000,000 (estimated)",N/A,1 hour 48 minutes,"Biography, Comedy, Crime"
249,tt3104988,Crazy Rich Asians,6.9,​Jon M. Chu,"​Peter Chiarelli, ​Adele Lim, ​Kevin Kwan","noneStars, ​Constance Wu, ​Henry Golding, ​Michelle Yeoh, noneStars",This contemporary romantic comedy based on a global bestseller follows native New Yorker Rachel Chu to Singapore to meet her boyfriend's family.,Release date,"United States, China","English, Mandarin, Cantonese, Hokkien, French, Malay","$30,000,000 (estimated)","$239,343,729",2 hours,"Comedy, Drama, Romance"
250,tt6166392,Wonka,7.0,​Paul King,"noneWriters, ​Roald Dahl, ​Paul King, ​Simon Farnaby, noneWriters","noneStars, ​Timothée Chalamet, ​Gustave Die, ​Murray McArthur, noneStars","With dreams of opening a shop in a city renowned for its chocolate, a young and poor Willy Wonka discovers that the industry is run by a cartel of greedy chocolatiers.",Release date,"United States, United Kingdom, Canada",English,"$125,000,000 (estimated)","$632,302,312",1 hour 56 minutes,"Adventure, Comedy, Family"
251,tt20215968,Hit Man,7.0,​Richard Linklater,"​Richard Linklater, ​Glen Powell, ​Skip Hollandsworth","noneStars, ​Glen Powell, ​Adria Arjona, ​Austin Amelio, noneStars","A professor moonlighting as a hit man of sorts for his city police department, descends into dangerous, dubious territory when he finds himself attracted to a woman who enlists his services.",Release date,United States,English,N/A,"$2,257,688",1 hour 55 minutes,"Comedy, Crime, Romance"
252,tt4919268,Bad Boys: Ride or Die,7.0,"​Adil El Arbi, ​Bilall Fallah","​Chris Bremner, ​Will Beall, ​George Gallo","noneStars, ​Will Smith, ​Martin Lawrence, ​Vanessa Hudgens, noneStars","This Summer, the world's favorite Bad Boys are back with their iconic mix of edge-of-your seat action and outrageous comedy but this time with a twist: Miami's finest are now on the run.",Release date,United States,English,"$100,000,000 (estimated)","$235,872,081",1 hour 55 minutes,"Action, Adventure, Comedy"
253,tt21454134,The Bikeriders,7.3,​Jeff Nichols,​Jeff Nichols,"noneStars, ​Jodie Comer, ​Austin Butler, ​Tom Hardy, noneStars","After a chance encounter, headstrong Kathy is drawn to Benny, member of Midwestern motorcycle club the Vandals. As the club transforms into a dangerous underworld of violence, Benny must choose between Kathy and his loyalty to the club.",Release date,United States,English,N/A,"$4,060,000",1 hour 56 minutes,"Crime, Drama"
254,tt1502397,Bad Boys for Life,6.5,"​Adil El Arbi, ​Bilall Fallah","noneWriters, ​Peter Craig, ​Joe Carnahan, ​Chris Bremner, noneWriters","noneStars, ​Will Smith, ​Martin Lawrence, ​Vanessa Hudgens, noneStars",Miami detectives Mike Lowrey and Marcus Burnett must face off against a mother-and-son pair of drug lords who wreak vengeful havoc on their city.,Release date,United States,"English, Spanish","$90,000,000 (estimated)","$426,505,244",2 hours 4 minutes,"Action, Comedy, Crime"
255,tt22048412,MaXXXine,N/A,​Ti West,"noneWriter, ​Ti West, noneWriter","noneStars, ​Mia Goth, ​Elizabeth Debicki, ​Moses Sumney, noneStars","In 1980s Hollywood, adult film star and aspiring actress Maxine Minx finally gets her big break. But as a mysterious killer stalks the starlets of Hollywood, a trail of blood threatens to reveal her sinister past.",Release date,"United States, United Kingdom",English,N/A,N/A,1 hour 43 minutes,"Crime, Horror"
256,tt0112442,Bad Boys,6.8,​Michael Bay,"noneWriters, ​George Gallo, ​Michael Barrie, ​Jim Mulholland, noneWriters","noneStars, ​Will Smith, ​Martin Lawrence, ​Lisa Boyle, noneStars",Two hip detectives protect a witness to a murder while investigating a case of stolen heroin from the evidence storage room from their police precinct.,Release date,United States,"English, Persian","$19,000,000 (estimated)","$141,407,024",1 hour 59 minutes,"Action, Comedy, Crime"
257,tt19637052,Love Lies Bleeding,6.7,​Rose Glass,"​Rose Glass, ​Weronika Tofilska","noneStars, ​Anna Baryshnikov, ​Kristen Stewart, ​Dave Franco, noneStars","Gym manager Lou falls for Jackie, a bodybuilder who is passing through town en route to a competition in Las Vegas.",Release date,"United Kingdom, United States",English,N/A,"$11,254,825",1 hour 44 minutes,"Action, Adventure, Crime"
258,tt0172156,Bad Boys II,6.6,​Michael Bay,"noneWriters, ​George Gallo, ​Marianne Wibberley, ​Cormac Wibberley, noneWriters","noneStars, ​Will Smith, ​Martin Lawrence, ​Gabrielle Union, noneStars",Two loose-cannon narcotics cops investigate the flow of Ecstasy into Florida from a Cuban drug cartel.,Release date,United States,"English, Spanish, Russian","$130,000,000 (estimated)","$273,340,010",2 hours 27 minutes,"Action, Comedy, Crime"
259,tt13923084,Boy Kills World,6.4,​Moritz Mohr,"noneWriters, ​Tyler Burton Smith, ​Arend Remmers, ​Moritz Mohr, noneWriters","noneStars, ​Bill Skarsgård, ​Jessica Rothe, ​Michelle Dockery, noneStars","A fever dream action film that follows Boy, a deaf person with a vibrant imagination. When his family is murdered, he is trained by a mysterious shaman to repress his childish imagination and become an instrument of death.",Release date,"Germany, South Africa, United States",English,N/A,"$3,142,357",1 hour 51 minutes,"Action, Crime, Thriller"
260,tt23468450,Longlegs,N/A,​Oz Perkins,​Oz Perkins,"noneStars, ​Maika Monroe, ​Nicolas Cage, ​Blair Underwood, noneStars","In pursuit of a serial killer, an FBI agent uncovers a series of occult clues that she must solve to end his terrifying killing spree.",Release date,"Canada, United States",English,N/A,N/A,1 hour 41 minutes,"Crime, Horror, Thriller"
261,tt15314262,The Beekeeper,6.4,​David Ayer,​Kurt Wimmer,"noneStars, ​Jason Statham, ​Emmy Raver-Lampman, ​Bobby Naderi, noneStars","One man's brutal campaign for vengeance takes on national stakes after he is revealed to be a former operative of a powerful and clandestine organization known as ""Beekeepers.""",Release date,"United States, United Kingdom",English,"$40,000,000 (estimated)","$152,720,535",1 hour 45 minutes,"Action, Crime, Thriller"
262,tt27578157,Colors of Evil: Red,6.3,​Adrian Panek,"​Lukasz M. Maciejewski, ​Adrian Panek, ​Malgorzata Oliwia Sobczak","noneStars, ​Jakub Gierszal, ​Maja Ostaszewska, ​Zofia Jastrzebska, noneStars","When a girl's body is found on a beach in Poland's Tricity, a prosecutor teams up with the victim's mother on an impassioned quest for the truth.",Release date,Poland,Polish,N/A,N/A,1 hour 51 minutes,"Crime, Drama, Mystery"
263,tt9214772,Monkey Man,6.9,​Dev Patel,"noneWriters, ​Dev Patel, ​Paul Angunawela, ​John Collee, noneWriters","noneStars, ​Dev Patel, ​Sharlto Copley, ​Pitobash, noneStars",An anonymous young man unleashes a campaign of vengeance against the corrupt leaders who murdered his mother and continue to systematically victimize the poor and powerless.,Release date,"United States, Canada, Singapore, India",English,"$10,000,000 (estimated)","$34,664,571",2 hours 1 minute,"Action, Crime, Thriller"
264,tt0068646,The Godfather,9.2,​Francis Ford Coppola,"noneWriters, ​Mario Puzo, ​Francis Ford Coppola, noneWriters","noneStars, ​Marlon Brando, ​Al Pacino, ​James Caan, noneStars",The aging patriarch of an organized crime dynasty transfers control of his clandestine empire to his reluctant son.,Release date,United States,"English, Italian, Latin","$6,000,000 (estimated)","$250,342,030",2 hours 55 minutes,"Crime, Drama"
