,Movie ID,Title,IMDB Rating,Directors,Writers,Stars,Storyline,Release Date,Origin Countries,Languages,Budget,Gross Worldwide,Runtime,Genres
157,tt0993846,The Wolf of Wall Street,8.2,​Martin Scorsese,"​Terence Winter, ​Jordan Belfort","noneStars, ​Leonardo DiCaprio, ​Jonah Hill, ​Margot Robbie, noneStars","Based on the true story of Jordan Belfort, from his rise to a wealthy stock-broker living the high life to his fall involving crime, corruption and the federal government.",Release date,United States,"English, French","$100,000,000 (estimated)","$407,039,432",3 hours,"Biography, Comedy, Crime"
158,tt0097937,My Left Foot,7.8,​Jim Sheridan,"​Shane Connaughton, ​Jim Sheridan, ​Christy Brown","noneStars, ​Daniel Day-Lewis, ​Brenda Fricker, ​Alison Whelan, noneStars","Christy Brown, born with cerebral palsy, learns to paint and write with his only controllable limb - his left foot.",Release date,"Ireland, United Kingdom",English,"£600,000 (estimated)","$14,743,391",1 hour 43 minutes,"Biography, Drama"
159,tt3758542,Ferrari,6.4,​Michael Mann,"​Troy Kennedy Martin, ​Brock Yates","noneStars, ​Adam Driver, ​Shailene Woodley, ​Giuseppe Festinese, noneStars","Set in the summer of 1957, with Enzo Ferrari's auto empire in crisis, the ex-racer turned entrepreneur pushes himself and his drivers to the edge as they launch into the Mille Miglia, a treacherous 1,000-mile race across Italy.",Release date,"United States, United Kingdom, Italy, Saudi Arabia",English,"$110,000,000 (estimated)","$42,285,029",2 hours 10 minutes,"Biography, Drama, History"
160,tt17076046,Weird: The Al Yankovic Story,6.9,​Eric Appel,"​'Weird Al' Yankovic, ​Eric Appel","noneStars, ​Diedrich Bader, ​Daniel Radcliffe, ​Lin-Manuel Miranda, noneStars","Explores every facet of Yankovic's life, from his meteoric rise to fame with early hits like 'Eat It' and 'Like a Surgeon' to his torrid celebrity love affairs and famously depraved lifestyle.",Release date,United States,English,"$8,000,000 (estimated)",N/A,1 hour 48 minutes,"Biography, Comedy, Crime"
161,tt0108052,Schindler's List,9.0,​Steven Spielberg,"​Thomas Keneally, ​Steven Zaillian","noneStars, ​Liam Neeson, ​Ralph Fiennes, ​Ben Kingsley, noneStars","In German-occupied Poland during World War II, industrialist Oskar Schindler gradually becomes concerned for his Jewish workforce after witnessing their persecution by the Nazis.",Release date,United States,"English, Hebrew, German, Polish, Latin","$22,000,000 (estimated)","$322,161,245",3 hours 15 minutes,"Biography, Drama, History"
162,tt23849204,12th Fail,8.9,​Vidhu Vinod Chopra,"noneWriters, ​Vidhu Vinod Chopra, ​Jaskunwar Kohli, ​Anurag Pathak, noneWriters","noneStars, ​Vikrant Massey, ​Medha Shankr, ​Anant Joshi, noneStars",The real-life story of IPS Officer Manoj Kumar Sharma and IRS Officer Shraddha Joshi.,Release date,India,"Hindi, Malayalam, Tamil, Telugu, Kannada",N/A,"$138,288",2 hours 27 minutes,"Biography, Drama"
163,tt0099685,Goodfellas,8.7,​Martin Scorsese,"noneWriters, ​Nicholas Pileggi, ​Martin Scorsese, noneWriters","noneStars, ​Robert De Niro, ​Ray Liotta, ​Joe Pesci, noneStars","The story of Henry Hill and his life in the mafia, covering his relationship with his wife Karen and his mob partners Jimmy Conway and Tommy DeVito.",Release date,United States,"English, Italian, Hebrew, Yiddish","$25,000,000 (estimated)","$47,049,784",2 hours 25 minutes,"Biography, Crime, Drama"
164,tt1950186,Ford v Ferrari,8.1,​James Mangold,"​Jez Butterworth, ​John-Henry Butterworth, ​Jason Keller","noneStars, ​Matt Damon, ​Christian Bale, ​Jon Bernthal, noneStars",American car designer Carroll Shelby and driver Ken Miles battle corporate interference and the laws of physics to build a revolutionary race car for Ford in order to defeat Ferrari at the 24 Hours of Le Mans in 1966.,Release date,United States,"English, Italian, French, Japanese","$97,600,000 (estimated)","$225,508,210",2 hours 32 minutes,"Action, Biography, Drama"
165,tt1485796,The Greatest Showman,7.5,​Michael Gracey,"noneWriters, ​Jenny Bicks, ​Bill Condon, noneWriters","noneStars, ​Hugh Jackman, ​Michelle Williams, ​Zac Efron, noneStars",Celebrates the birth of show business and tells of a visionary who rose from nothing to create a spectacle that became a worldwide sensation.,Release date,United States,English,"$84,000,000 (estimated)","$438,550,994",1 hour 45 minutes,"Biography, Drama, Musical"
166,tt6966692,Green Book,8.2,​Peter Farrelly,"​Nick Vallelonga, ​Brian Hayes Currie, ​Peter Farrelly","noneStars, ​Viggo Mortensen, ​Mahershala Ali, ​Linda Cardellini, noneStars",A working-class Italian-American bouncer becomes the driver for an African-American classical pianist on a tour of venues through the 1960s American South.,Release date,"United States, China","English, Italian, Russian, German","$23,000,000 (estimated)","$321,752,656",2 hours 10 minutes,"Biography, Comedy, Drama"
167,tt10869778,Maidaan,8.1,​Amit Ravindernath Sharma,"noneWriters, ​Akash Chawla, ​Sidhant Mago, ​Saiwyn Quadras, noneWriters","noneStars, ​Ajay Devgn, ​Priyamani, ​Gajraj Rao, noneStars","Inspired by the Indian national football team coach and manager Syed Abdul Rahim, who is regarded as the architect of Indian football.",Release date,India,"Hindi, Malayalam, Tamil, Telugu",N/A,"$371,226",3 hours 1 minute,"Biography, Drama, History"
168,tt7598076,Curiosa,5.4,​Lou Jeunet,"noneWriters, ​Lou Jeunet, ​Raphaëlle Desplechin, ​Pierre Louÿs, noneWriters","noneStars, ​Noémie Merlant, ​Niels Schneider, ​Benjamin Lavernhe, noneStars","A passionate love story set against a backdrop of sexual freedom, loosely based on the relationship between 19th-century authors Pierre Louÿs and Marie de Régnier.",Release date,France,French,N/A,"$114,949",1 hour 47 minutes,"Biography, Drama, History"
169,tt13287846,Napoleon,6.4,​Ridley Scott,​David Scarpa,"noneStars, ​Joaquin Phoenix, ​Vanessa Kirby, ​Tahar Rahim, noneStars","An epic that details the chequered rise and fall of French Emperor Napoleon Bonaparte and his relentless journey to power through the prism of his addictive, volatile relationship with his wife, Josephine.",Release date,"United States, United Kingdom","English, French, Russian, German, Italian","$200,000,000 (estimated)","$221,379,385",2 hours 38 minutes,"Action, Adventure, Biography"
170,tt1596363,The Big Short,7.8,​Adam McKay,"​Charles Randolph, ​Adam McKay, ​Michael Lewis","noneStars, ​Christian Bale, ​Steve Carell, ​Ryan Gosling, noneStars","In 2006-2007 a group of investors bet against the United States mortgage market. In their research, they discover how flawed and corrupt the market is.",Release date,United States,English,"$28,000,000 (estimated)","$133,440,870",2 hours 10 minutes,"Biography, Comedy, Drama"
171,tt13957560,Dumb Money,6.9,​Craig Gillespie,"​Lauren Schuker Blum, ​Rebecca Angelo, ​Ben Mezrich","noneStars, ​Paul Dano, ​Pete Davidson, ​Vincent D'Onofrio, noneStars",David vs. Goliath tale about everyday people who flipped the script on Wall Street and got rich by turning GameStop (the video-game store) into the world's hottest company.,Release date,United States,English,"$30,000,000 (estimated)","$20,703,794",1 hour 45 minutes,"Biography, Comedy, Drama"
172,tt0108358,Tombstone,7.8,"​George P. Cosmatos, ​Kevin Jarre",​Kevin Jarre,"noneStars, ​Kurt Russell, ​Val Kilmer, ​Sam Elliott, noneStars","A successful lawman's plans to retire anonymously in Tombstone, Arizona, are disrupted by the kind of outlaws he was famous for eliminating.",Release date,United States,"English, Latin, Spanish","$25,000,000 (estimated)","$56,505,065",2 hours 10 minutes,"Biography, Drama, History"
173,tt8368368,The Apprentice,N/A,​Ali Abbasi,​Gabriel Sherman,"noneStars, ​Sebastian Stan, ​Jeremy Strong, ​Maria Bakalova, noneStars",The story of how a young Donald Trump started his real estate business in 1970s and 80s New York with the helping hand of infamous lawyer Roy Cohn.,Release date,"Canada, Denmark, Ireland",English,N/A,N/A,2 hours,"Biography, Drama, History"
174,tt5177114,Young Woman and the Sea,7.7,​Joachim Rønning,"​Jeff Nathanson, ​Glenn Stout","noneStars, ​Daisy Ridley, ​Tilda Cobham-Hervey, ​Stephen Graham, noneStars","The story of competitive swimmer Trudy Ederle, who, in 1926, was the first woman to ever swim across the English Channel.",Release date,"United States, Hungary, Italy, United Kingdom, France",English,N/A,"$581,725",2 hours 9 minutes,"Biography, Drama, Romance"
175,tt16227342,Mr. & Mrs. Mahi,6.5,​Sharan Sharma,"​Nikhil Mehrotra, ​Sharan Sharma","noneStars, ​Janhvi Kapoor, ​Rajkummar Rao, ​Kumud Mishra, noneStars",A married couple who share a love for cricket begin training in the game due to her natural talent.,Release date,India,Hindi,N/A,"$309,852",2 hours 19 minutes,"Biography, Drama, Sport"
176,tt2119532,Hacksaw Ridge,8.1,​Mel Gibson,"​Robert Schenkkan, ​Andrew Knight","noneStars, ​Andrew Garfield, ​Sam Worthington, ​Luke Bracey, noneStars","World War II American Army Medic Desmond T. Doss, serving during the Battle of Okinawa, refuses to kill people and becomes the first man in American history to receive the Medal of Honor without firing a shot.",Release date,United States,"English, Japanese","$40,000,000 (estimated)","$180,563,636",2 hours 19 minutes,"Biography, Drama, History"
177,tt2461150,Masterminds,5.8,​Jared Hess,"noneWriters, ​Chris Bowman, ​Hubbel Palmer, ​Emily Spivey, noneWriters","noneStars, ​Zach Galifianakis, ​Owen Wilson, ​Kristen Wiig, noneStars",A guard at an armored car company in the Southern U.S. organizes one of the biggest bank heists in American history. Based on the October 1997 Loomis Fargo robbery.,Release date,United States,"English, Spanish","$25,000,000 (estimated)","$29,674,699",1 hour 35 minutes,"Biography, Comedy, Crime"
178,tt13097932,One Life,7.5,​James Hawes,"​Lucinda Coxon, ​Nick Drake, ​Barbara Winton","noneStars, ​Anthony Hopkins, ​Lena Olin, ​Johnny Flynn, noneStars","Sir Nicholas 'Nicky' Winton, a young London broker who, in the months leading up to World War II, rescued over 600 children from Nazi-occupied Czechoslovakia.",Release date,United Kingdom,"English, German, Czech, French",N/A,"$53,615,600",1 hour 49 minutes,"Biography, Drama, History"
179,tt20561198,The Promised Land,7.7,​Nikolaj Arcel,"​Nikolaj Arcel, ​Anders Thomas Jensen, ​Ida Jessen","noneStars, ​Mads Mikkelsen, ​Amanda Collin, ​Simon Bennebjerg, noneStars",The story of Ludvig Kahlen who pursued his lifelong dream: To make the heath bring him wealth and honor.,Release date,"Denmark, Sweden, Norway, Germany","Danish, Swedish, German, Norwegian","$8,500,000 (estimated)","$2,041,868",2 hours 7 minutes,"Action, Biography, Drama"
180,tt0086879,Amadeus,8.4,​Milos Forman,"noneWriters, ​Peter Shaffer, ​Zdenek Mahler, noneWriters","noneStars, ​F. Murray Abraham, ​Tom Hulce, ​Elizabeth Berridge, noneStars","The life, success and troubles of Wolfgang Amadeus Mozart, as told by Antonio Salieri, the contemporaneous composer who was deeply jealous of Mozart's talent and claimed to have murdered him.",Release date,"United States, France","English, Italian, Latin, German, French","$18,000,000 (estimated)","$52,071,304",2 hours 40 minutes,"Biography, Drama, Music"
181,tt4846340,Hidden Figures,7.8,​Theodore Melfi,"​Allison Schroeder, ​Theodore Melfi, ​Margot Lee Shetterly","noneStars, ​Taraji P. Henson, ​Octavia Spencer, ​Janelle Monáe, noneStars",The story of a team of female African-American mathematicians who served a vital role in NASA during the early years of the U.S. space program.,Release date,United States,English,"$25,000,000 (estimated)","$235,957,472",2 hours 7 minutes,"Biography, Drama, History"
182,tt0112573,Braveheart,8.3,​Mel Gibson,​Randall Wallace,"noneStars, ​Mel Gibson, ​Sophie Marceau, ​Patrick McGoohan, noneStars",Scottish warrior William Wallace leads his countrymen in a rebellion to free his homeland from the tyranny of King Edward I of England.,Release date,United States,"English, French, Latin, Gaelic, Italian","$72,000,000 (estimated)","$213,216,216",2 hours 58 minutes,"Biography, Drama, War"
183,tt8521778,Bob Marley: One Love,6.3,​Reinaldo Marcus Green,"noneWriters, ​Terence Winter, ​Frank E. Flowers, ​Zach Baylin, noneWriters","noneStars, ​Kingsley Ben-Adir, ​Lashana Lynch, ​James Norton, noneStars","The story of how reggae icon Bob Marley overcame adversity, and the journey behind his revolutionary music.",Release date,United States,English,N/A,"$179,393,170",1 hour 47 minutes,"Biography, Drama, Music"
184,tt11378946,Michael,N/A,​Antoine Fuqua,​John Logan,"noneStars, ​Miles Teller, ​Kat Graham, ​Nia Long, noneStars","The story of the famous musician Michael Jackson, known as the King of Pop.",Release date,"United States, United Kingdom",English,"$155,000,000 (estimated)",N/A,N/A,"Biography, Drama, History"
185,tt22041854,Priscilla,6.5,​Sofia Coppola,"​Priscilla Presley, ​Sandra Harmon, ​Sofia Coppola","noneStars, ​Cailee Spaeny, ​Jacob Elordi, ​Ari Cohen, noneStars","When teenage Priscilla Beaulieu meets Elvis Presley, the man who is already a meteoric rock-and-roll superstar becomes someone entirely unexpected in private moments: a thrilling crush, an ally in loneliness, a vulnerable best friend.",Release date,"Italy, United States",English,N/A,"$33,023,994",1 hour 53 minutes,"Biography, Drama, Music"
186,tt7599146,Sound of Freedom,7.6,​Alejandro Monteverde,"​Rod Barr, ​Alejandro Monteverde","noneStars, ​Jim Caviezel, ​Mira Sorvino, ​Bill Camp, noneStars",The incredible true story of a former government agent turned vigilante who embarks on a dangerous mission to rescue hundreds of children from traffickers.,Release date,"Mexico, United States","English, Spanish","$14,600,000 (estimated)","$250,570,396",2 hours 11 minutes,"Biography, Crime, Drama"
187,tt0268978,A Beautiful Mind,8.2,​Ron Howard,"​Akiva Goldsman, ​Sylvia Nasar","noneStars, ​Russell Crowe, ​Ed Harris, ​Jennifer Connelly, noneStars","A mathematical genius, John Nash made an astonishing discovery early in his career and stood on the brink of international acclaim. But the handsome and arrogant Nash soon found himself on a harrowing journey of self-discovery.",Release date,United States,English,"$58,000,000 (estimated)","$316,791,257",2 hours 15 minutes,"Biography, Drama, Mystery"
188,tt0253474,The Pianist,8.5,​Roman Polanski,"​Ronald Harwood, ​Wladyslaw Szpilman","noneStars, ​Adrien Brody, ​Thomas Kretschmann, ​Frank Finlay, noneStars","During WWII, acclaimed Polish musician Wladyslaw faces various struggles as he loses contact with his family. As the situation worsens, he hides in the ruins of Warsaw in order to survive.",Release date,"France, Poland, Germany, United Kingdom, United States","English, German, Russian","$35,000,000 (estimated)","$120,098,945",2 hours 30 minutes,"Biography, Drama, Music"
189,tt0264464,Catch Me If You Can,8.1,​Steven Spielberg,"​Frank Abagnale Jr., ​Stan Redding, ​Jeff Nathanson","noneStars, ​Leonardo DiCaprio, ​Tom Hanks, ​Christopher Walken, noneStars","Barely 17 yet, Frank is a skilled forger who has passed as a doctor, lawyer and pilot. FBI agent Carl becomes obsessed with tracking down the con man, who only revels in the pursuit.",Release date,"United States, Canada","English, French","$52,000,000 (estimated)","$352,114,312",2 hours 21 minutes,"Biography, Crime, Drama"
190,tt3704428,Elvis,7.3,​Baz Luhrmann,"noneWriters, ​Baz Luhrmann, ​Sam Bromell, ​Craig Pearce, noneWriters","noneStars, ​Tom Hanks, ​Austin Butler, ​Olivia DeJonge, noneStars","The life of American music icon Elvis Presley, from his childhood to becoming a rock and movie star in the 1950s while maintaining a complex relationship with his manager, Colonel Tom Parker.",Release date,"United States, Australia",English,"$85,000,000 (estimated)","$288,670,284",2 hours 39 minutes,"Biography, Drama, Music"
191,tt2084970,The Imitation Game,8.0,​Morten Tyldum,"​Graham Moore, ​Andrew Hodges","noneStars, ​Benedict Cumberbatch, ​Keira Knightley, ​Matthew Goode, noneStars","During World War II, the English mathematical genius Alan Turing tries to crack the German Enigma code with help from fellow mathematicians while attempting to come to terms with his troubled private life.",Release date,"United Kingdom, United States","English, German","$14,000,000 (estimated)","$233,555,708",1 hour 54 minutes,"Biography, Drama, Thriller"
192,tt16277242,Society of the Snow,7.8,​J.A. Bayona,"noneWriters, ​J.A. Bayona, ​Bernat Vilaplana, ​Jaime Marques, noneWriters","noneStars, ​Enzo Vogrincic, ​Agustín Pardella, ​Matías Recalt, noneStars",The flight of a rugby team crashes on a glacier in the Andes. The few passengers who survive the crash find themselves in one of the world's toughest environments to survive.,Release date,"Spain, Chile, Uruguay, United States",Spanish,N/A,"$1,281",2 hours 24 minutes,"Adventure, Biography, Drama"
193,tt14351082,Cabrini,7.4,​Alejandro Monteverde,"noneWriters, ​Rod Barr, ​Alejandro Monteverde, noneWriters","noneStars, ​Cristiana Dell'Anna, ​John Lithgow, ​David Morse, noneStars","After witnessing disease and poverty in the slums of New York, Italian immigrant Francesca Cabrini embarks on a daring journey to persuade the hostile mayor to provide housing and healthcare for hundreds of orphaned children.",Release date,United States,English,"$34,000,000 (estimated)","$20,444,332",2 hours 22 minutes,"Biography, Drama"
194,tt3569230,Legend,6.9,​Brian Helgeland,"​Brian Helgeland, ​John Pearson","noneStars, ​Tom Hardy, ​Emily Browning, ​Taron Egerton, noneStars",Identical twin gangsters Ronald and Reginald Kray terrorize London during the 1960s.,Release date,"United Kingdom, France, United States",English,"$30,000,000 (estimated)","$42,972,994",2 hours 12 minutes,"Biography, Crime, Drama"
195,tt1285016,The Social Network,7.8,​David Fincher,"​Aaron Sorkin, ​Ben Mezrich","noneStars, ​Jesse Eisenberg, ​Andrew Garfield, ​Justin Timberlake, noneStars","As Harvard student Mark Zuckerberg creates the social networking site that would become known as Facebook, he is sued by the twins who claimed he stole their idea and by the co-founder who was later squeezed out of the business.",Release date,United States,"English, French","$40,000,000 (estimated)","$224,927,749",2 hours,"Biography, Drama"
196,tt9071322,Dark Waters,7.6,​Todd Haynes,"​Nathaniel Rich, ​Mario Correa, ​Matthew Michael Carnahan","noneStars, ​Mark Ruffalo, ​Anne Hathaway, ​Tim Robbins, noneStars",A corporate defense attorney takes on an environmental lawsuit against a chemical company that exposes a lengthy history of pollution.,Release date,United States,"English, Korean",N/A,"$23,108,017",2 hours 6 minutes,"Biography, Drama, History"
197,tt1152836,Public Enemies,7.0,​Michael Mann,"noneWriters, ​Ronan Bennett, ​Michael Mann, ​Ann Biderman, noneWriters","noneStars, ​Christian Bale, ​Johnny Depp, ​Christian Stolte, noneStars","The Feds try to take down notorious American gangsters John Dillinger, Baby Face Nelson, and Pretty Boy Floyd during a booming crime wave in the 1930s.",Release date,"United States, Japan",English,"$100,000,000 (estimated)","$214,104,620",2 hours 20 minutes,"Action, Biography, Crime"
198,tt0059742,The Sound of Music,8.1,​Robert Wise,"noneWriters, ​Georg Hurdalek, ​Howard Lindsay, ​Russel Crouse, noneWriters","noneStars, ​Julie Andrews, ​Christopher Plummer, ​Eleanor Parker, noneStars",A young novice is sent by her convent in 1930s Austria to become a governess to the seven children of a widowed naval officer.,Release date,United States,"English, German","$8,200,000 (estimated)","$159,475,084",2 hours 52 minutes,"Biography, Drama, Family"
199,tt1302006,The Irishman,7.8,​Martin Scorsese,"​Steven Zaillian, ​Charles Brandt","noneStars, ​Robert De Niro, ​Al Pacino, ​Joe Pesci, noneStars","An illustration of Frank Sheeran's life, from W.W.II veteran to hit-man for the Bufalino crime family and his alleged assassination of his close friend Jimmy Hoffa.",Release date,United States,"English, Italian, Latin, Spanish, German","$159,000,000 (estimated)","$968,853",3 hours 29 minutes,"Biography, Crime, Drama"
200,tt1979320,Rush,8.1,​Ron Howard,​Peter Morgan,"noneStars, ​Daniel Brühl, ​Chris Hemsworth, ​Olivia Wilde, noneStars",The merciless 1970s rivalry between Formula One rivals James Hunt and Niki Lauda.,Release date,"United Kingdom, United States","English, German, Italian, French, Spanish","$38,000,000 (estimated)","$96,992,516",2 hours 3 minutes,"Action, Biography, Drama"
201,tt20215968,Hit Man,7.0,​Richard Linklater,"​Richard Linklater, ​Glen Powell, ​Skip Hollandsworth","noneStars, ​Glen Powell, ​Adria Arjona, ​Austin Amelio, noneStars","A professor moonlighting as a hit man of sorts for his city police department, descends into dangerous, dubious territory when he finds himself attracted to a woman who enlists his services.",Release date,United States,English,N/A,"$2,257,688",1 hour 55 minutes,"Comedy, Crime, Romance"
202,tt4919268,Bad Boys: Ride or Die,7.0,"​Adil El Arbi, ​Bilall Fallah","​Chris Bremner, ​Will Beall, ​George Gallo","noneStars, ​Will Smith, ​Martin Lawrence, ​Vanessa Hudgens, noneStars","This Summer, the world's favorite Bad Boys are back with their iconic mix of edge-of-your seat action and outrageous comedy but this time with a twist: Miami's finest are now on the run.",Release date,United States,English,"$100,000,000 (estimated)","$235,872,081",1 hour 55 minutes,"Action, Adventure, Comedy"
203,tt22022452,Inside Out 2,8.0,​Kelsey Mann,"noneWriters, ​Meg LeFauve, ​Dave Holstein, ​Kelsey Mann, noneWriters","noneStars, ​Amy Poehler, ​Maya Hawke, ​Kensington Tallman, noneStars","Follows Riley, in her teenage years, encountering new emotions.",Release date,"United States, Japan",English,"$200,000,000 (estimated)","$512,383,116",1 hour 36 minutes,"Animation, Adventure, Comedy"
204,tt1684562,The Fall Guy,7.0,​David Leitch,"​Glen A. Larson, ​Drew Pearce","noneStars, ​Ryan Gosling, ​Emily Blunt, ​Aaron Taylor-Johnson, noneStars",A down-and-out stuntman must find the missing star of his ex-girlfriend's blockbuster film.,Release date,"United States, Australia, Canada",English,"$125,000,000 (estimated)","$170,853,974",2 hours 6 minutes,"Action, Comedy, Drama"
205,tt2096673,Inside Out,8.1,"​Pete Docter, ​Ronnie Del Carmen","noneWriters, ​Pete Docter, ​Ronnie Del Carmen, ​Meg LeFauve, noneWriters","noneStars, ​Amy Poehler, ​Bill Hader, ​Lewis Black, noneStars","After young Riley is uprooted from her Midwest life and moved to San Francisco, her emotions - Joy, Fear, Anger, Disgust and Sadness - conflict on how best to navigate a new city, house, and school.",Release date,United States,"English, Portuguese, Latvian","$175,000,000 (estimated)","$858,852,998",1 hour 35 minutes,"Animation, Adventure, Comedy"
206,tt27995594,Munjya,7.5,​Aditya Sarpotdar,"​Niren Bhatt, ​Yogesh Chandekar, ​Tushar Ajgaonkar","noneStars, ​Sharvari Wagh, ​Samarth Kaimliya, ​Abhay Verma, noneStars","A young man's visit to his native village unveils a family secret and a vengeful spirit, the Munjya, who wants to get married. Now the young man must fight to protect himself and his love from Munjya's clutches.",Release date,India,,N/A,"$62,896",2 hours 3 minutes,"Comedy, Horror"
207,tt6263850,Deadpool & Wolverine,N/A,​Shawn Levy,"noneWriters, ​Shawn Levy, ​Rhett Reese, ​Ryan Reynolds, noneWriters","noneStars, ​Ryan Reynolds, ​Hugh Jackman, ​Emma Corrin, noneStars",Wolverine is recovering from his injuries when he crosses paths with the loudmouth Deadpool. They team up to defeat a common enemy.,Release date,United States,English,N/A,N/A,2 hours 7 minutes,"Action, Comedy, Sci-Fi"
208,tt26047818,Anyone But You,6.1,​Will Gluck,"noneWriters, ​Ilana Wolpert, ​Will Gluck, noneWriters","noneStars, ​Sydney Sweeney, ​Glen Powell, ​Alexandra Shipp, noneStars","After an amazing first date, Bea and Ben's fiery attraction turns ice-cold--until they find themselves unexpectedly reunited at a wedding in Australia. So they do what any two mature adults would do: pretend to be a couple.",Release date,"Australia, United States",English,"$25,000,000 (estimated)","$220,088,760",1 hour 43 minutes,"Comedy, Romance"
209,tt11152168,IF,6.6,​John Krasinski,​John Krasinski,"noneStars, ​Cailey Fleming, ​Ryan Reynolds, ​John Krasinski, noneStars",A young girl who goes through a difficult experience begins to see everyone's imaginary friends who have been left behind as their real-life friends have grown up.,Release date,"United States, Canada",English,"$110,000,000 (estimated)","$177,218,104",1 hour 44 minutes,"Animation, Comedy, Drama"
210,tt11225626,Am I OK?,6.1,"​Stephanie Allynne, ​Tig Notaro",​Lauren Pomerantz,"noneStars, ​Dakota Johnson, ​Sonoya Mizuno, ​Jermaine Fowler, noneStars","Lucy and Jane have been best friends their entire lives. Only when Lucy embarks on a personal journey, will she face a test of her friendship, and her sense of self, on a path she may not be entirely ready to take.",Release date,United States,English,N/A,N/A,1 hour 26 minutes,"Comedy, Drama, Romance"
